keyword,search_volume,keyword_difficulty,cpc,cluster
adult soccer league near me,5400,0,2.19,adult_soccer
soccer league adult,2900,5,4.44,adult_soccer
adult soccer league,2900,10,4.44,adult_soccer
adult league soccer,2900,10,4.44,adult_soccer
shoreline adult soccer league,880,0,0.00,adult_soccer
pasadena adult soccer league,590,0,2.77,adult_soccer
adult soccer league pasadena,590,0,2.77,adult_soccer
tucson adult soccer league,480,0,0.00,adult_soccer
adult soccer league tucson,480,0,0.00,adult_soccer
temecula adult soccer league,390,3,0.00,adult_soccer
beaches adult soccer league,320,0,0.00,adult_soccer
jurupa adult soccer league,260,0,0.00,adult_soccer
indoor soccer adult league near me,260,0,1.54,adult_soccer
indoor adult soccer league,260,0,2.88,adult_soccer
hoboken adult soccer league,260,2,4.61,adult_soccer
adult indoor soccer league,260,1,2.88,adult_soccer
adult indoor soccer league near me,260,0,1.54,adult_soccer
novato adult soccer league,210,0,2.82,adult_soccer
conroe adult soccer league,210,0,0.00,adult_soccer
bay area adult soccer league,210,3,2.50,adult_soccer
soccer adult league near me,170,6,5.05,adult_soccer
los angeles adult soccer league,170,0,3.10,adult_soccer
claremont adult soccer league,170,6,0.00,adult_soccer
bozeman adult soccer league,170,0,0.00,adult_soccer
adult women's soccer league near me,170,0,3.41,adult_soccer
adult soccer league los angeles,170,0,3.10,adult_soccer
wilmington adult soccer league,140,0,0.00,adult_soccer
san diego adult soccer league,140,6,3.72,adult_soccer
sacramento adult soccer league,140,0,1.56,adult_soccer
palo alto adult soccer league,140,0,0.00,adult_soccer
orange county adult soccer league,140,0,4.09,adult_soccer
houston adult soccer league,140,0,0.59,adult_soccer
ct adult soccer league,140,0,3.30,adult_soccer
connecticut adult soccer league,140,0,3.30,adult_soccer
adult soccer league san diego,140,0,3.72,adult_soccer
adult soccer league sacramento,140,0,1.56,adult_soccer
adult soccer league orange county,140,0,4.09,adult_soccer
adult soccer league houston,140,0,0.59,adult_soccer
adult soccer league ct,140,0,3.30,adult_soccer
adult soccer league chicago,140,13,0.69,adult_soccer
